Title,URL,Advertiser,Location,Listing Date,Short Description
** Mid & Senior Full Stack PHP Developers - Cloud Based SaaS Product **,https://www.seek.com.au/jobs/job/36542060?type=standard,Sydney,"CBD, Inner West & Eastern Suburbs",22h ago,"Web, Mobile &amp; Cloud projects. Hackathons. Learn ReactJS, VueJS or NodeJS. Work on global products! Agile, TDD, CI/CD environment! Contract &amp; Perm AV"
Senior PHP Developer,https://www.seek.com.au/jobs/job/36538376?type=standout,2XM Technology Pty Ltd,Sydney,2d ago,"My client based in Surry Hills are looking to add 2 Senior PHP Developers to their team, they have recently taken on numerous high profile clients"
Senior PHP Developer - Media,https://www.seek.com.au/jobs/job/36538370?type=standout,2XM Technology Pty Ltd,Sydney,2d ago,One of my clients who are an industry leading media organisation are looking to add a Senior PHP Developer to their team
FullStack PHP DEVELOPER,https://www.seek.com.au/jobs/job/36537199?type=standard,Opus Recruitment Solutions,Sydney,2d ago,Fullstack PHP / Contract / Sydney / Lucrative Rates
Senior PHP Developer,https://www.seek.com.au/jobs/job/36529226?type=standout,2XM Technology Pty Ltd,Sydney,3d ago,"My client based in Surry Hills are looking to add 2 Senior PHP Developers to their team, they have recently taken on numerous high profile clients"
Senior PHP Developer - Media,https://www.seek.com.au/jobs/job/36529441?type=standout,2XM Technology Pty Ltd,Sydney,3d ago,One of my clients who are an industry leading media organisation are looking to add a Senior PHP Developer to their team
Senior PHP Developer / Architect,https://www.seek.com.au/jobs/job/36516687?type=standard,Alternative Media,Sydney,4d ago,We are looking for an Senior PHP / Web developer to join our growing Tech team. Join our fun and challenging team!
PHP Developer Laravel,https://www.seek.com.au/jobs/job/36530541?type=standout,Digital Pacific,Sydney,2d ago,Great Software Developer opportunity to work in the biggest Web Hosting company in Australia. Apply your experience &amp; be exposed to new technologies!
Full Stack PHP Developer,https://www.seek.com.au/jobs/job/36495768?type=standard,Robert Walters,Sydney,6d ago,This leading healthcare company is looking for Full Stack PHP Developer to work on web applications.
FullStack PHP DEVELOPER,https://www.seek.com.au/jobs/job/36484284?type=standard,Opus Recruitment Solutions,Sydney,9d ago,Fullstack PHP / Contract To Perm / Sydney / Lucrative Rates
PHP Developer,https://www.seek.com.au/jobs/job/36483982?type=standard,IPA,Sydney,9d ago,I am currently looking for a junior to mid-level PHP developer 
PHP/WordPress Developer - Exciting new projects!,https://www.seek.com.au/jobs/job/36462531?type=standout,2XM Technology Pty Ltd,Sydney,11d ago,"A fantastic opportunity to work in a team of 5 with yearly, upskilling budget, learn develop and thrive!"
PHP Developer,https://www.seek.com.au/jobs/job/36436459?type=standard,FTP Software,Sydney,15d ago,PHP Developer for M3 Solutions
PHP Developer,https://www.seek.com.au/jobs/job/36424735?type=standout,Horizon Consulting,Sydney,16d ago,Looking for the best of the best - Software Engineers (OO PHP) -  Surry Hills based technology company
PHP with Front End,https://www.seek.com.au/jobs/job/36409414?type=standard,S2M,Sydney,18d ago,"Seeking an PHP Software Engineer to develop, manage, and maintain a fully automated data retention and backup system, HTML/CSS a bonus"
"Multiple FRONT END UI Developer Roles: Javascript, Angular 4/5, ReactJS, NodeJS",https://www.seek.com.au/jobs/job/36542095?type=standard,Sydney,"CBD, Inner West & Eastern Suburbs",22h ago,"Interesting work that will push and develop your Javascript skills! Single Page Apps, Angular 2/4/5, ReactJS, HTML5, CSS3. Multiple roles in Sydney"
Front End Developer PHP,https://www.seek.com.au/jobs/job/36395116?type=standard,SAI Global Limited,Sydney,19d ago,Combine the art of design with the art of programming. Responsibilities will include translation of the UI/UX design wireframes to actual code.
Senior Full Stack Developer - PHP,https://www.seek.com.au/jobs/job/36394821?type=standard,SAI Global Limited,Sydney,19d ago,Translate software requirements into concise and robust programming code.
Full Stack PHP Developer,https://www.seek.com.au/jobs/job/36390037?type=standard,Opus Recruitment Solutions,Sydney,20d ago,EXCITING FULL STACK PHP DEVELOPMENT ROLE | 6 MONTH CONTRACT | DOMINANT AWARD WINNING PRODUCT COMPANY | 
Web Developer - Front End | Responsive UI,https://www.seek.com.au/jobs/job/36538774?type=standard,Barringtons Recruitment Group Pty Ltd,Sydney,2d ago,"Well established, creative, digital agency, diverse client projects. Responsive UI, Mobile solutions, Front End web developer. HTML5, CSS3, JavaScript"
Senior Drupal Developer / Lead,https://www.seek.com.au/jobs/job/36537489?type=standout,Digital Garden,Sydney,2d ago,Digital Garden is looking for a person with energy and a true passion for Drupal particularly around backend development.
Drupal Developer,https://www.seek.com.au/jobs/job/36537124?type=standard,Opus Recruitment Solutions,Sydney,2d ago,JOIN A MARKET LEADING COMPANY | 6 MONTH CONTRACT WITH POTENTIAL EXTENSION | LUCRATIVE DAY RATE
Technical Lead,https://www.seek.com.au/jobs/job/36533799?type=standout,Interactiveinc  PTY LTD,Sydney,2d ago,Technical Lead - Drupal - Award winning Agency - $130K
Drupal Developer - Contract,https://www.seek.com.au/jobs/job/36533398?type=standout,Bauer Media Group,Sydney,2d ago,8 week contract approx. with an immediate start!
Senior Drupal Developer (Back-end),https://www.seek.com.au/jobs/job/36526514?type=standard,Naviro,Sydney,3d ago,"Senior Drupal Dev to focus on the back-end - Sydney CBD - 6 Mths+ - Drupal 8 / Symfony - High-Traffic, High Profile Org and sites!"
Drupal Senior Back End Developer,https://www.seek.com.au/jobs/job/36522477?type=standard,Greythorn,Sydney,3d ago,Work for an innovative government agency
Senior Full Stack LAMP Developer (virtual),https://www.seek.com.au/jobs/job/36518780?type=standout,SWOOP Analytics Pty Ltd,Sydney,4d ago,We're looking for an experienced full stack LAMP developer to join our very virtual team of about 10 people.
Front End Developer - React / Redux / Webpack / AEM / LESS / HTML,https://www.seek.com.au/jobs/job/36508824?type=standout,Paxus Australia Pty Ltd,Sydney,5d ago,Senior Front End Developer for a leading online financial business based in North Sydney with 5+ years’ exp - React /Redux /Webpack /AEM / LESS / HTML
Senior Drupal Developer,https://www.seek.com.au/jobs/job/36492990?type=standard,CITI Recruitment,Sydney,6d ago,Seeking an outstanding creative Drupal developer to help continue to provide support and create the most innovative and spectacular products
Technical Lead - SaaS ASX Company.,https://www.seek.com.au/jobs/job/36486783?type=standard,Talenza,Sydney,8d ago,**You will be joining as a technical lead for a exciting and challenging role with market leader in data analytics/ Company culture 2nd to none!**
Senior PHP Developer,https://www.seek.com.au/jobs/job/36378509?type=standard,Genesis IT&T P/L,Sydney,23d ago,Excellent opportunity for career progression and a chance to grow your skills. Excellent start - up with heaps of exciting projects.
Multiple Full Stack JavaScript / Front End Developer Roles | React / Node,https://www.seek.com.au/jobs/job/36486049?type=standard,TheDriveGroup,Sydney,8d ago,"Multiple NEW Roles - Mixture of React.js, React Native &amp; Node projects - all Sydney based - contract &amp; perm available - Click here to find out more..."
Development Lead,https://www.seek.com.au/jobs/job/36479727?type=standout,SAI Global,Sydney,9d ago,Looking for a hands-on Development Lead role? Are you a experienced Full Stack Developer? This role might be for you
Developer,https://www.seek.com.au/jobs/job/36475871?type=standard,King & Wood Mallesons,Sydney,9d ago,We are recruiting for an experienced Developer to join our Sydney based Technology team.
Senior Magento Developer,https://www.seek.com.au/jobs/job/36475200?type=standard,ZALA,Sydney,9d ago,"Lead Magento Dev with some creative flare and passion for their work required for in house, full-time role at thriving online boutique."
Lead Front End Software Engineer,https://www.seek.com.au/jobs/job/36471986?type=standard,Unikrn Pty Ltd,Sydney,9d ago,"The ideal candidate will be comfortable working in a startup environment, wear multiple hats and drive a tight schedule."
AWS Cloud DevOps/Deployment Egineer,https://www.seek.com.au/jobs/job/35994650?type=standout,Amazon Web Services,Sydney,10d ago,Seeking highly motivated DevOps engineers who are passionate about technology &amp; want to work with one of the fastest growing Cloud platforms
PHP Developer - Mid Level,https://www.seek.com.au/jobs/job/36366134?type=standout,ACY Capital Pty Ltd,Sydney,24d ago,This unique role offers you the opportunity to be part of a new team of product designers and developers.
Mid-Level Drupal Developer (Brisbane Location),https://www.seek.com.au/jobs/job/36469045?type=standout,Paxus Australia Pty Ltd,Sydney,10d ago,Looking for a smart and motivated Mid-level Drupal Developer to join an excellent and reputable organization in Brisbane’s CBD fringe.
Mid-Level Software Engineer (PHP),https://www.seek.com.au/jobs/job/36354622?type=standout,Real Time Australia P/L,Sydney,25d ago,One of Australia's best kept Technology secrets is looking for a Mid-Level PHP Engineer to be a part of their exceptional (&amp; international) growth !!
Junior Software Engineer (PHP),https://www.seek.com.au/jobs/job/36351550?type=standout,Real Time Australia P/L,Sydney,25d ago,One of Australia's best kept Technology secrets is looking for a Junior PHP Engineer to be a part of their exceptional (&amp; international) growth !!
AWS Solution Design Lead,https://www.seek.com.au/jobs/job/36461854?type=standout,Talent – Winner ‘Seek Large Recruitment Agency of the Year’ 3 consecutive years!,Sydney,11d ago,Fantastic opportunity for an AWS Solution Design Engineer to take the Lead on an exciting project with a leading FMCG Corporate
Full Stack PHP Developer,https://www.seek.com.au/jobs/job/36355764?type=standard,Opus Recruitment Solutions,Sydney,25d ago,EXCITING FULL STACK PHP DEVELOPMENT ROLE | 3 MONTH CONTRACT | DOMINANT AWARD WINNING PRODUCT COMPANY | 
Cloud Engineer,https://www.seek.com.au/jobs/job/36460814?type=standard,Progressive,Sydney,11d ago,Currently looking for a Cloud Engineer for a 6 months contract with a view to extend starting ASAP based near Parramatta 
PHP Developer,https://www.seek.com.au/jobs/job/36353083?type=standout,Altitude Recruitment,Sydney,25d ago,Altitude is looking for a Mid-level  PHP Developer for a permanent position in Parramatta NSW $80K
Magento Developer - Permanent,https://www.seek.com.au/jobs/job/36457148?type=standout,Talent – Winner ‘Seek Large Recruitment Agency of the Year’ 3 consecutive years!,Sydney,11d ago,"This position is a rarely-seen opening within this global giant.  You will be amongst some of the finest with the Australian marketplace, and"
Front-End Developer - SharePoint,https://www.seek.com.au/jobs/job/36453517?type=standard,DXC,Sydney,11d ago,Seeking an experienced Front-End Developer that specialises in SharePoint to join an existing project with one of our Tier 1 clients.
Senior DevOps Engineer,https://www.seek.com.au/jobs/job/36451499?type=standout,Onset Group,Sydney,12d ago,Senior leadership required for the largest AWS project in Australia. Well respected &amp; instantly recognisable organisation.
Services and Interaction Design Consultant,https://www.seek.com.au/jobs/job/36215202?type=standout,Accenture,Sydney,12d ago,"Unleash the power of digital to drive growth, create new sources of value and transform business."
Senior Front-End Developer - Angular,https://www.seek.com.au/jobs/job/36432770?type=standard,IT GLOBAL PTY LTD,Sydney,16d ago,An outstanding front-end developer with a passion for software development of business applications. Be proficient in Angular 2 above.
Full Stack Developer,https://www.seek.com.au/jobs/job/36412485?type=standard,Genesis IT&T P/L,Sydney,18d ago,Excellent opportunity for career progression and a chance to grow your skills. Excellent start - up with heaps of exciting projects.
Development Lead,https://www.seek.com.au/jobs/job/36398328?type=standard,SAI Global Limited,Sydney,19d ago,Looking for a hands-on Development Lead role? Are you a experienced Full Stack Developer? This role might be for you
Front End Developer,https://www.seek.com.au/jobs/job/36397994?type=standout,Digital Pacific,Sydney,19d ago,NEWLY CREATED ROLE! Have an impact on how we get our products out to our customers and ensure that our customers online experience is next to none!
PHP Developer - PHP/Laravel/AWS - SaaS product,https://www.seek.com.au/jobs/job/36321686?type=standard,Talenza,Sydney,30d ago,**You will be joining as a mid-to-senior developer for a exciting and challenging role - PHP/Laravel/AWS - ASX listed SaaS company!**
Technical Lead - SaSS Product - PHP/Laravel/AWS,https://www.seek.com.au/jobs/job/36321600?type=standard,Talenza,Sydney,30d ago,**You will be joining as a technical lead for a exciting and challenging role - PHP/Laravel/AWS - ASX listed SaaS company!**
1x Front End & 1x NodeJS Developer - Global Cloud Based SAAS Products,https://www.seek.com.au/jobs/job/36390176?type=standard,Sydney,"CBD, Inner West & Eastern Suburbs",20d ago,"Web, Mobile &amp; Cloud projects. Hackathons. Learn NodeJS. Work on global products! Agile, TDD, CI/CD environment!"
Drupal Developer,https://www.seek.com.au/jobs/job/36384728?type=standard,Opus Recruitment Solutions,Sydney,20d ago,JOIN A MARKET LEADING COMPANY | 6 MONTH CONTRACT WITH POTENTIAL EXTENSION | LUCRATIVE DAY RATE
Senior SugarCRM / PHP Developer,https://www.seek.com.au/jobs/job/36321479?type=standout,Loaded Technologies,Sydney,30d ago,"We are seeking a high calibre, team-oriented PHP Developer with 5+ years web development experience including 2+ years on Sugar 7+."
Full Stack Web Developer at DSYNC,https://www.seek.com.au/jobs/job/36378757?type=standout,Octerpus Pty Ltd,Sydney,23d ago,"Awesome dev needed, Fantastic opportunity to work for one of Australia's fastest growing technology companies. Great people, great tech, room to grow"
Drupal Senior Developer,https://www.seek.com.au/jobs/job/36375954?type=standard,Kelly Government Solutions,Sydney,23d ago,"Position Title : Drupal Senior Developer 
Location : Parramatta
Duration : 5 months with potential extension
Availability : Immediate."
Drupal Senior Developer,https://www.seek.com.au/jobs/job/36375714?type=standard,Kelly Government Solutions,Sydney,23d ago,"Position Title : Drupal Senior Developer 
Location : Sydney CBD
Duration : 5 months with potential extension
Availability : Immediate."
Full Stack Developer,https://www.seek.com.au/jobs/job/36375307?type=standard,Polyglot Group,Sydney,23d ago,Looking for your next challenge within a fast-growing company? This opportunity as a Full Stack Developer is for you!
DevOps Lead,https://www.seek.com.au/jobs/job/36374717?type=standard,FIRESOFT Consulting,Sydney,23d ago,We are looking for a Devops Lead to join a global company with great career opportunities and perks!!
Java Developer,https://www.seek.com.au/jobs/job/36373282?type=standard,Become,Sydney,23d ago,2 x Senior Java Developers – 3 month initial contract
Full Stack Developer - Drupal or Symfony with React,https://www.seek.com.au/jobs/job/36370041?type=standard,Sirius Technology Sydney part of Sirius People Pty Ltd,Sydney,23d ago,"A Sydney (CBD) based software company are looking for a talented developer to join their expert team, work with Symfony, Drupal and React.JS "
Senior DevOps Engineer,https://www.seek.com.au/jobs/job/36359174?type=standout,Onset Group,Sydney,24d ago,Join one of the largest AWS projects in the country with an instantly recognisable media organisation.
WordPress Developer - Exciting new projects!,https://www.seek.com.au/jobs/job/36354865?type=standout,2XM Technology Pty Ltd,Sydney,25d ago,"A fantastic opportunity to work in a team of 5 with yearly, upskilling budget, learn develop and thrive!"
Lead Developer | Jimmy Brings,https://www.seek.com.au/jobs/job/36350520?type=standard,Woolworth Liquor Group,Sydney,25d ago,Jimmy Brings is Australia's first on-demand alcohol delivery company; we need a Lead Dev to grow with our business bringing their coding expertise.
Front End Web Developer,https://www.seek.com.au/jobs/job/36344015?type=standout,4wd Supacentre,Sydney,26d ago,4WD SUPACENTRE is one of Australia's leading and fastest growing omni-channel retailers; specialising in outdoor adventure and lifestyle products !
Front-End Web Developer - eCommerce/Shopify/HTML/CSS/JavaScript,https://www.seek.com.au/jobs/job/36338271?type=standard,Process Creative,Sydney,26d ago,Seeking a Front End Dev to join our full service digital agency based in Surry Hills. Specialise in Shopify e-commerce stores.
Magento Developer,https://www.seek.com.au/jobs/job/36334614?type=standout,2XM Technology Pty Ltd,Sydney,27d ago,Fantastic opportunity to work for a enterprise level company on high level application used by millions of users.
Front-end / Back-end / Full-Stack Developers,https://www.seek.com.au/jobs/job/36333427?type=standout,The Creative Store,Sydney,27d ago,The Creative Store is your specialist recruitment agency – IT / Digital / Development Jobs. Great Jobs. Great People. www.thecreativestore.com.au
Software Developer,https://www.seek.com.au/jobs/job/36326427?type=standard,Preacta Recruitment,Sydney,27d ago,Sensational opportunity exists for a Software Developer to join a rapidly expanding e-commerce company
Software engineer,https://www.seek.com.au/jobs/job/36320493?type=standout,SuperEd Pty Ltd,Sydney,30d ago,Fintech startup looking for a mid level software engineer to join the team in developing a robo-advice platform.
Senior DevOps Engineer,https://www.seek.com.au/jobs/job/36319451?type=standout,2XM Technology Pty Ltd,Sydney,30d ago,Work for one of the worlds largest media agencies in and exciting newly created Senior DevOps role
Web Developer x2,https://www.seek.com.au/jobs/job/36318479?type=standard,Helloworld Travel Limited,Sydney,30d ago,Helloworld Travel Limited need your expertise as a Web Developer to work with our Business Systems and Applications team.
AWS Engineer,https://www.seek.com.au/jobs/job/36167702?type=standard,Data#3 People Solutions,Sydney,30d+ ago,ASAP Start for an AWS Engineer with our prestigious client.
