Title,URL,Advertiser,Location,Listing Date,Short Description
Mid-Level PHP Developer,https://www.seek.com.au/jobs/job/36322330?type=promoted,Fulfilio,Melbourne,"","We are looking for a very TALENTED, PASSIONATE, FULL HANDS-ON and professional mid-senior PHP developer with solid commercial experience."
Software Developer PHP Specialist,https://www.seek.com.au/jobs/job/36387426?type=promoted,Health Metrics Pty Ltd,Melbourne,"",We are seeking an experienced PHP Software Developer with a combined passion for software development and and product innovation.
Back-end PHP/Symfony Developer - 3M contract,https://www.seek.com.au/jobs/job/36541889?type=standard,Greythorn,Melbourne,15h ago,Are you a passionate PHP Engineer with strong back-end skills on AWS?? APPLY NOW!!
PHP Developer - CakePHP,https://www.seek.com.au/jobs/job/36531716?type=standard,Sirius Technology Melbourne part of Sirius People Pty Ltd,Melbourne,2d ago,"An international company located in Melbourne's South Eastern suburbs, is looking for a skilled and passionate PHP Developer with CakePHP experience!"
Web Developer (PHP 7 + Laravel),https://www.seek.com.au/jobs/job/36539458?type=standout,Spring Professional Ltd,Melbourne,1d ago,"Permanent opportunity based in Melbourne's inner-CBD suburbs, looking to start ASAP. Seeking someone skilled in LAMP stack and Javascript frameworks."
Senior Web Developer (HTML/CSS/JavaScript & PHP),https://www.seek.com.au/jobs/job/36530421?type=standard,Green IT Talent Pty Ltd,Melbourne,2d ago,New permanent role available for a Senior Developer; front end development of HTML/CSS/JavaScrip. Backend PHP development required.
Senior PHP Developer - PETstock Head Office,https://www.seek.com.au/jobs/job/36539922?type=standout,PETstock,Melbourne,1d ago,"Assist the eCommerce team to drive a world class customer experience for all PETstock customers, by building and developing our website and assets"
Senior PHP Developer,https://www.seek.com.au/jobs/job/36529852?type=standard,Opus Recruitment Solutions,Melbourne,2d ago,EXCITING OPPORTUNITY FOR A PASSIONATE &amp; TALENTED SENIOR PHP DEVELOPER TO BE A PART OF A TECH START UP DIGITAL AGENCY!
Full Stack PHP Developer,https://www.seek.com.au/jobs/job/36522763?type=standard,Opus Recruitment Solutions,Melbourne,3d ago,EXCITING FULL STACK PHP DEVELOPMENT ROLE | 6 MONTH CONTRACT | DOMINANT AWARD WINNING PRODUCT COMPANY | 
PHP Developer - Location Adelaide,https://www.seek.com.au/jobs/job/36522474?type=standout,Modis,Melbourne,3d ago,Looking for an experienced PHP Developer for a Adelaide based role.
PHP Developer - Location Adelaide,https://www.seek.com.au/jobs/job/36519431?type=standout,Modis,Melbourne,3d ago,Looking for an experienced PHP Developer for a Adelaide based role.
PHP Developer with MVC Government 12 Months,https://www.seek.com.au/jobs/job/36515674?type=standout,Altitude Recruitment,Melbourne,3d ago,Altitude is looking for an experienced PHP Developer for Government.12 Months Contract
Laravel/PHP Developer - 6/12 month contract,https://www.seek.com.au/jobs/job/36508171?type=standard,Sirius Technology Melbourne part of Sirius People Pty Ltd,Melbourne,4d ago,We are URGENTLY looking for a Senior PHP Developer with Laravel experience to undertake a 6-12 month contract and immediate start.
PHP Developer,https://www.seek.com.au/jobs/job/36501817?type=standard,Opus Recruitment Solutions,Melbourne,5d ago,"Fintech start up seeking a solid bilingual developer who speaks Cantonese/Mandarin.
Will need to have Laravel, PHP and also front end knowledge."
Full Stack PHP Developer,https://www.seek.com.au/jobs/job/36500208?type=standard,Charterhouse,Melbourne,5d ago,Full Stack PHP/Python Developer - 12 Month inital FTC - Sydney CBD
PHP Developer - 12 month contract - Attractive Rate!,https://www.seek.com.au/jobs/job/36499318?type=standard,PBI Search,Melbourne,5d ago,"Work as a PHP Developer for this rapidly expanding Digital Agency, developing world-class web sites and more for a global client portfolio."
FullStack PHP DEVELOPER,https://www.seek.com.au/jobs/job/36497494?type=standard,Opus Recruitment Solutions,Melbourne,5d ago,Fullstack PHP / Contract To Perm / Sydney / Lucrative Rates
WordPress/PHP Developer,https://www.seek.com.au/jobs/job/36495551?type=standard,Sirius Technology Melbourne part of Sirius People Pty Ltd,Melbourne,5d ago,Vibrant boutique software development company located in Melbourne's inner north west is looking for a skilled and passionate WordPress/PHP Developer!
PHP Developer,https://www.seek.com.au/jobs/job/36495321?type=standout,Liquid Digital Agency,Melbourne,5d ago,Liquid are looking for a Senior/Mid PHP Developer to join our award-winning agency and lead our web and digital projects. Immediate start available.
PHP developer,https://www.seek.com.au/jobs/job/36491899?type=standard,Yolk Agency,Melbourne,5d ago,The successful candidate will have 1-2 years of PHP code. You must have good stakeholder skills.
Analyst - PHP/SQL,https://www.seek.com.au/jobs/job/36487254?type=standard,Clicks IT Recruitment,Melbourne,6d ago,Seeking a candidate who has experience in PHP and SQL for a 3 month contract. This opportunity will be based in the Eastern suburbs of Melbourne.
Analyst - PHP/SQL,https://www.seek.com.au/jobs/job/36487251?type=standard,Clicks IT Recruitment,Melbourne,6d ago,Seeking a candidate who has experience in PHP and SQL for a 3 month contract. This opportunity will be based in the Eastern suburbs of Melbourne.
Experienced PHP/Magento Web Developer,https://www.seek.com.au/jobs/job/36427844?type=promoted,Jairus Pty Ltd,Melbourne,"",Looking to combine your passion for frog hat wearing monkeys AND cutting crazy good code? Well click on over and apply dang darn it!
PHP Developer,https://www.seek.com.au/jobs/job/36495321?type=promoted,Liquid Digital Agency,Melbourne,"",Liquid are looking for a Senior/Mid PHP Developer to join our award-winning agency and lead our web and digital projects. Immediate start available.
Senior PHP Developer,https://www.seek.com.au/jobs/job/36488006?type=standard,PBI Search,Melbourne,6d ago,"Work as Senior PHP Developer, building a next generation eCommerce platform for this rapidly expanding eCommerce company."
"Fullstack Web Developer - HTML5, CSS3, PHP, SQL",https://www.seek.com.au/jobs/job/36508779?type=standout,Premium IT Recruitment,Melbourne,4d ago,"Fullstack Developer, migrate from Flash to new framework, React, Angular, Vue, Eastern suburbs location, boutique software company, friendly team, CRM"
PHP Web Developer  |Award Winning Digital Organization,https://www.seek.com.au/jobs/job/36506230?type=standard,Pearson Frank International,Melbourne,4d ago,Melbourne | Web Developer | Niche Digital Organization | Attractive salary package | Great team | Career progression opportunities
PHP - Laravel/Python/C# Intermediate Developer,https://www.seek.com.au/jobs/job/36504095?type=standard,Corporate Initiatives,Melbourne,4d ago,"Are you a passionate developer wanting to work in a growing &amp; dynamic dev team, 12 month contract view to ongoing"
PHP developer $110K to $120K plus super,https://www.seek.com.au/jobs/job/36486000?type=standard,SuperCoders IT Recruitment Melbourne,Melbourne,8d ago,"We're looking for PHP developers with a passion for development, who have personal projects and LOVE to expand their knowledge."
PHP/SQL Consultant,https://www.seek.com.au/jobs/job/36480269?type=standout,Ignite,Melbourne,8d ago,PHP Consultant role with excellent day rates
Senior Web Developer (HTML/CSS/JavaScript & PHP),https://www.seek.com.au/jobs/job/36473964?type=standard,Green IT Talent Pty Ltd,Melbourne,9d ago,Immediate start contract available for a Senior Developer; front end development of HTML/CSS/JavaScrip. Backend PHP development required.
PHP Developer - Multiple roles!,https://www.seek.com.au/jobs/job/36481085?type=standout,2XM Technology Pty Ltd,Melbourne,8d ago,PHP Developer - Multiple roles!
Developer - PHP,https://www.seek.com.au/jobs/job/36473191?type=standard,Opus Recruitment Solutions,Melbourne,9d ago,"SUMMARY: 
EXCITING OPPORTUNITY FOR A PASSIONATE &amp; TALENTED FULL STACK PHP DEVELOPER TO BE A PART OF A TECH START UP DELIVERING SERVICE!"
Analyst - PHP/SQL,https://www.seek.com.au/jobs/job/36466917?type=standard,Clicks IT Recruitment,Melbourne,9d ago,Seeking a candidate who has experience in PHP and SQL for a 3 month contract. This opportunity will be based in the Eastern suburbs of Melbourne.
Full Stack PHP Developer,https://www.seek.com.au/jobs/job/36473340?type=standard,Opus Recruitment Solutions,Melbourne,9d ago,EXCITING FULL STACK PHP DEVELOPMENT ROLE | 6 MONTH CONTRACT | DOMINANT AWARD WINNING PRODUCT COMPANY | 
Senior PHP Developer,https://www.seek.com.au/jobs/job/36464212?type=standout,Loyalty Corp Australia Pty Ltd,Melbourne,10d ago,Australia's leading Loyalty Fintech company is currently seeking talented Senior PHP developers to join its progressive and innovative team.
Senior PHP Developer,https://www.seek.com.au/jobs/job/36463122?type=standout,FourQuarters Recruitment,Melbourne,10d ago,Mid - Senior level PHP Developer - Symfony required for a CBD based Australian software company
Senior PHP Developer,https://www.seek.com.au/jobs/job/36461205?type=standard,Astute Payroll,Melbourne,10d ago,"Looking for a senior and passionate PHP engineer to join the Astute Family. Great CBD office, fun environment, amazing team. Challenges Await!"
Senior Software Engineer - PHP,https://www.seek.com.au/jobs/job/36451578?type=standout,FourQuarters Recruitment,Melbourne,11d ago,Full-stack PHP engineering opportunity with a highly reputable product development team
SENIOR Full stack PHP Developer,https://www.seek.com.au/jobs/job/36470815?type=standard,Perfectly Placed Recruitment,Melbourne,9d ago,"You will use your expertise and knowledge to assist in the implementation of new projects, as well as maintaining existing software and applications."
Full Time/Part Time - Intermediate PHP Developer,https://www.seek.com.au/jobs/job/36449983?type=standard,TheTubes,Melbourne,11d ago,"We are looking for a PHP/MySQL developer who is enthusiastic and hungry to learn, with some experience."
PHP Developer - 12 month contract - Attractive Rate!,https://www.seek.com.au/jobs/job/36448226?type=standard,PBI Search,Melbourne,11d ago,"Work as a PHP Developer for this rapidly expanding Digital Agency, developing world-class web sites and more for a global client portfolio."
PHP Developer,https://www.seek.com.au/jobs/job/36446522?type=standout,Vault,Melbourne,11d ago,We're after a multi-talented developer with backend PHP and frontend web development skills who can play a big role in our continuing growth.
Senior PHP Developer,https://www.seek.com.au/jobs/job/36448459?type=standard,PBI Search,Melbourne,11d ago,"Work as Senior PHP Developer, building a next generation eCommerce platform for this rapidly expanding eCommerce company."
Experienced PHP/Magento Web Developer,https://www.seek.com.au/jobs/job/36427844?type=promoted,Jairus Pty Ltd,Melbourne,"",Looking to combine your passion for frog hat wearing monkeys AND cutting crazy good code? Well click on over and apply dang darn it!
PHP SQL Mapping Documenting,https://www.seek.com.au/jobs/job/36460454?type=standard,Interface Recruitment,Melbourne,10d ago,Basic Mapping and Documentation role to suit junior or experienced Programmer.
PHP Developer - 12 month contract - Attractive Rate!,https://www.seek.com.au/jobs/job/36423261?type=standard,PBI Search,Melbourne,16d ago,"Work as a PHP Developer for this rapidly expanding Digital Agency, developing world-class web sites and more for a global client portfolio."
Senior PHP Developer,https://www.seek.com.au/jobs/job/36422954?type=standard,PBI Search,Melbourne,16d ago,"Work as Senior PHP Developer, building a next generation eCommerce platform for this rapidly expanding eCommerce company."
Experienced PHP/Magento Web Developer,https://www.seek.com.au/jobs/job/36427844?type=standout,Jairus Pty Ltd,Melbourne,15d ago,Looking to combine your passion for frog hat wearing monkeys AND cutting crazy good code? Well click on over and apply dang darn it!
PHP Developer,https://www.seek.com.au/jobs/job/36418174?type=standard,FIRESOFT Consulting,Melbourne,16d ago,"MID SENIOR FULL STACK DEVELOPER  (PHP/Angular/React)

Candidate must be able to work in an agile environment as part of a small team"
PHP Developer | MELBOURNE | Award winning digital consultancy,https://www.seek.com.au/jobs/job/36183726?type=standard,Adelphi Digital,Melbourne,16d ago,We are looking for experienced .PHP developers to join our international digital consultancy located in the heart of the CBD
Moodle PHP Developer,https://www.seek.com.au/jobs/job/36430019?type=standard,Greythorn,Melbourne,15d ago,Are you an experienced Moodle Developer who wants to join this new Moodle project team?? APPLY NOW!!
Senior Web Developer (HTML/CSS/JavaScript & PHP),https://www.seek.com.au/jobs/job/36412876?type=standard,Green IT Talent Pty Ltd,Melbourne,17d ago,New 2+ month contract available for a Senior Developer; front end development of HTML/CSS/JavaScrip. Backend PHP development beneficial.
PHP Integration Engineer,https://www.seek.com.au/jobs/job/36421772?type=standout,Arney Recruitment,Melbourne,16d ago,Help make interviewing a better process.  This business is on a mission to use new technology to make interviewing easier.
Developer - PHP/ReactJS - IoT Project (3 Week Contract),https://www.seek.com.au/jobs/job/36422948?type=standout,FourQuarters Recruitment,Melbourne,16d ago,A fast growing application development company need somebody to work on an innovative IoT project right away!
PHP Web Developer,https://www.seek.com.au/jobs/job/36404956?type=standout,Michael Page Technology,Melbourne,18d ago,"PHP Web Developer, 3 month contract "
Full Time Senior PHP Web Developer / Programmer,https://www.seek.com.au/jobs/job/36405904?type=standard,AWD,Melbourne,18d ago,Sr PHP Developer who can help build the web presences of small/medium business &amp; can lead a team to execute digital solutions for larger organisations
Wordpress PHP Developer - $110K+ Melbourne,https://www.seek.com.au/jobs/job/36407167?type=standout,Altitude Recruitment,Melbourne,17d ago,Altitude require a Senior Wordpress PHP Developer for an award winning Digital Agency in Melbourne.
PHP Developer,https://www.seek.com.au/jobs/job/36420972?type=standard,Robert Half Technology,Melbourne,16d ago,Apply your software engineering skills to a diverse and engaging workplace focused in delivering a range of web products and solutions. 
Back End PHP Developer,https://www.seek.com.au/jobs/job/36419560?type=standout,MessageMedia,Melbourne,16d ago,"As part of our Product Development Team you'll play a key role in building new products, including our Web Product and customer API’s"
Mid Senior PHP Developer,https://www.seek.com.au/jobs/job/36400441?type=standard,FIRESOFT Consulting,Melbourne,18d ago,"Mid-Senior PHP developer

"
PHP Developer,https://www.seek.com.au/jobs/job/36398859?type=standard,Just Digital People,Melbourne,18d ago,Seeking a PHP developer who is interested in/willing to learn Magento. Call Olivia on 0447 312 609
Wordpress Developer,https://www.seek.com.au/jobs/job/36529014?type=standard,Opus Recruitment Solutions,Melbourne,2d ago,EXCITING FULL STACK PHP/Wordpress DEVELOPER ROLE | 6 MONTH CONTRACT | ADVANCE YOUR CAREER
PHP Developer,https://www.seek.com.au/jobs/job/36392681?type=standard,Opus Recruitment Solutions,Melbourne,19d ago,EXCITING OPPORTUNITY FOR A PASSIONATE &amp; TALENTED FULL STACK PHP DEVELOPER TO BE A PART OF A TECH START UP DELIVERING SERVICE!
Web Developer (PHP 7 + Laravel),https://www.seek.com.au/jobs/job/36400714?type=standout,Spring Professional Ltd,Melbourne,18d ago,"Permanent opportunity based in Melbourne's inner-CBD suburbs, looking to start ASAP. Seeking someone skilled in LAMP stack and Javascript frameworks."
Senior PHP Full Stack Web Developer,https://www.seek.com.au/jobs/job/36401186?type=standout,99designs,Melbourne,18d ago,We're after a passionate full stack web developer to join our Melbourne office building the world's best graphic design marketplace
Software Developer PHP Specialist,https://www.seek.com.au/jobs/job/36387426?type=standout,Health Metrics Pty Ltd,Melbourne,19d ago,We are seeking an experienced PHP Software Developer with a combined passion for software development and and product innovation.
Web Developer ( PHP - Drupal ),https://www.seek.com.au/jobs/job/36392131?type=standard,Pearson Frank International,Melbourne,19d ago,Melbourne | Web Developer | Niche Digital Organization | Attractive salary package | Great team | Career progression opportunities
Senior PHP Developer,https://www.seek.com.au/jobs/job/36399310?type=standard,Opus Recruitment Solutions,Melbourne,18d ago,"SYMFONY WIZARD NEEDED| FAST GROWING COMPANY|FIN-TECH | $100,000 - $125,000 + SUPER | MELBOURNE CBD 
"
PHP Developer|$60k - $80k + Super|Inner City,https://www.seek.com.au/jobs/job/36385423?type=standard,Robert Half Technology,Melbourne,19d ago,An opportunity to develop a lucrative career whilst building applications using strong PHP engineering principles 
Senior PHP Developer,https://www.seek.com.au/jobs/job/36385976?type=standard,PBI Search,Melbourne,19d ago,"Work as Senior PHP Developer, building a next generation eCommerce platform for this rapidly expanding eCommerce company."
Saas Support Engineer,https://www.seek.com.au/jobs/job/36500832?type=standout,EBSCO Australia,Melbourne,5d ago,"Technical SaaS support role: bring your programming skills and web development experience with HTML, PHP and JavaScript; great team"
PHP Developer,https://www.seek.com.au/jobs/job/36383263?type=standard,Just Digital People,Melbourne,20d ago,Looking to learn and grow with your next role? Look no further and call Olivia on 0447312609
PHP developer $110K to $120K plus super,https://www.seek.com.au/jobs/job/36379859?type=standard,SuperCoders IT Recruitment Melbourne,Melbourne,22d ago,"We're looking for PHP developers with a passion for development, who have personal projects and LOVE to expand their knowledge."
Backend Developer,https://www.seek.com.au/jobs/job/36542114?type=standout,Exelect Recruitment,Melbourne,13h ago,You’ll be responsible for development &amp; effective management of web &amp; system integrations to ensure no down time &amp; great experience for users globally
PHP Developer,https://www.seek.com.au/jobs/job/36378753?type=standard,Melbourne,CBD & Inner Suburbs,22d ago,"Advanced knowledge of OOP, knowledge in architecture, design patterns, Extensive experience with PHP 5/7 and frameworks"
Moodle PHP Developer - 3M - start ASAP,https://www.seek.com.au/jobs/job/36380024?type=standard,Greythorn,Melbourne,21d ago,Are you an experienced Moodle Developer who wants to join this new Moodle project team?? APPLY NOW!!
Senior PHP Developer,https://www.seek.com.au/jobs/job/36369649?type=standard,PBI Search,Melbourne,23d ago,"Work as Senior PHP Developer, building a next generation eCommerce platform for this rapidly expanding eCommerce company."
Full Stack PHP Js React Developer,https://www.seek.com.au/jobs/job/36365008?type=standard,FIRESOFT Consulting,Melbourne,23d ago,A highly successful Melbourne based start up is looking for a talented Full Stack PHP Js React Developer to join its dedicated team 
Lead PHP Developer,https://www.seek.com.au/jobs/job/36372808?type=standout,FourQuarters Recruitment,Melbourne,22d ago,Exciting opportunity to lead and guide a team whilst working on the latest technologies with one of Australia's leading FinTech companies
Contract Drupal Developer,https://www.seek.com.au/jobs/job/36529904?type=standout,Rowben Consulting - Integrity | Quality | Commitment,Melbourne,2d ago,Drupal Development | Daily Rate Contract | CBD Location
PHP Developer x2,https://www.seek.com.au/jobs/job/36362602?type=standard,Davidson Technology,Melbourne,23d ago,Currently looking to speak to passionate PHP Developer's who would be interested in a permanent role in Bundoora.
Senior Software Engineer,https://www.seek.com.au/jobs/job/36404613?type=standout,Wesfarmers Industrial and Safety,Melbourne,18d ago,"Fantastic opportunity to shape success for our exciting digital growth strategy. Great close knit, collegiate team and career development step! "
Mid-level Magento Developer | Senior Magento Developer | Lead,https://www.seek.com.au/jobs/job/36540983?type=standard,Sirius Technology Melbourne part of Sirius People Pty Ltd,Melbourne,1d ago,"Multiple roles for:
- Mid-level Magento Developer(s)
- Senior Magento Developer(s)
- Lead Magento Developer

Work for a market leader!"
Web Developer ( Drupal / Magento ),https://www.seek.com.au/jobs/job/36539988?type=standard,Pearson Frank International,Melbourne,1d ago,Melbourne | Drupal Developer | Niche Digital Organization | Attractive salary package | Great Office culture | Close to cafe's and Restaurants
EOI CS VE Teacher Diploma of Information Technology,https://www.seek.com.au/jobs/job/36538139?type=standard,RMIT University,Melbourne,1d ago,"We are currently inviting expressions of interest for sessional teachers in our Diploma of Information Technology program for Semester 2, 2018"
Backend Developer,https://www.seek.com.au/jobs/job/36536844?type=standout,Exelect Recruitment,Melbourne,1d ago,‎You’ll be responsible for development &amp; effective management of web &amp; system integrations to ensure no down time &amp; great experience for global users.
Web Developer - Drupal,https://www.seek.com.au/jobs/job/36535732?type=standard,Greythorn,Melbourne,1d ago,Drupal Web Developer in the heart of Melbourne!
TechCar - Web Developer,https://www.seek.com.au/jobs/job/36534095?type=standout,Melbourne,Northern Suburbs,1d ago,"HTML, CSS and JavaScript, experience working with SQL or a variant thereof, web server and 3rd party API’s experience required."
PHP Laravel Developer,https://www.seek.com.au/jobs/job/36352850?type=standout,Altitude Recruitment,Melbourne,24d ago,"Altitude is looking for a Junior - Mid level PHP Developer for a permanent position in Melbourne, $100K"
Gun PHP Developer,https://www.seek.com.au/jobs/job/36353963?type=standout,Melbourne,Western Suburbs,24d ago,"Are you passionate about PHP? Do you live and breathe it, is it both a career and a hobby? If so we want to talk to you!"
"PHP Developer / Designer - JavaScript, Node.JS, Angular, PHP Software Engineer",https://www.seek.com.au/jobs/job/36347714?type=standard,Infinity Pro,Melbourne,25d ago,"PHP, JavaScript Full Stack Analyst Developer/ Architect Software Engineer - Unix Shell Script - PHP, Node JS, JavaScript Programmer - Benefits Inside"
Head of Software Engineering,https://www.seek.com.au/jobs/job/36530346?type=standout,Bace,Melbourne,2d ago,"Bace is seeking a lead software developer to assist in creating major applications, websites &amp; databases."
Technical Lead - Fullstack or Web/Mobile Developer,https://www.seek.com.au/jobs/job/36501126?type=standard,Ynomia,Melbourne,2d ago,-Lead the mobile/web app front-end and user interface visualisation | Help definte the technical and product roadmap | Foster and promote learning
Web Developer,https://www.seek.com.au/jobs/job/36520183?type=standard,Nose to Tail,Melbourne,3d ago,"Fantastic opportunity to join a fun, fast-paced marketing agency and take the lead on all things web"
Full Stack Web Developer,https://www.seek.com.au/jobs/job/36520131?type=standout,Technology 360 Group,Melbourne,3d ago,Fantastic opportunity for a Mid to Senior level Full Stack Web Developer in our Engineering &amp; Development team!
"PHP Full Stack Developer - JavaScript, Node.JS, Laravel, PHP Software Engineer",https://www.seek.com.au/jobs/job/36345447?type=standard,Infinity Pro,Melbourne,25d ago,"PHP, JavaScript Full Stack Senior Analyst Developer, Software Engineer - Unix, Linux Shell Script - PHP, Node, JavaScript Programmer - Benefits Inside"
Ruby on Rails Developer,https://www.seek.com.au/jobs/job/36519090?type=standard,Pathfinder Recruitment,Melbourne,3d ago,"Ruby on Rails Developer needed for Tech solutions company based in Melbourne. Great career , salary and projects to work on."
Senior Software Engineer - Web UI Build,https://www.seek.com.au/jobs/job/36515953?type=standout,FourQuarters Recruitment,Melbourne,3d ago,A golden opportunity for talented UI Engineer/Architect to join a rapidly growing product development team.
Big Data & CakePHP Software developer,https://www.seek.com.au/jobs/job/36515742?type=standard,Coaches Avenue,Melbourne,3d ago,Big Data &amp; CakePHP Software developer
Software Developer,https://www.seek.com.au/jobs/job/36515757?type=standout,Melbourne,Bayside & South Eastern Suburbs,3d ago,"Join our R&amp;D Team extending through hardware device research, design and implementing of new features and core product maintenance."
Teachers (Sessional) - Full Stack Web Designer/Developer,https://www.seek.com.au/jobs/job/36515512?type=standard,Holmesglen Institute,Melbourne,3d ago,Are you looking to take a break from industry? Teaching is a great way to put back into the web community &amp; guide the next generation of web designers
Attention WordPress developers – We are looking for a gun!,https://www.seek.com.au/jobs/job/36514972?type=standard,Yolk Agency,Melbourne,3d ago,"Funky Port Melbourne location. Are you looking to work in a funky agency with cool clients? Flexible salary $80K-$90K+ super neg, based on exp"
Graduate - Junior Web Developer,https://www.seek.com.au/jobs/job/36512378?type=standout,AroFlo,Melbourne,4d ago,"Do you want to work for the most progressive, culturally sound and forward thinking company in the Eastern Suburbs? This is THAT job!"
Graphic Designer / Web Designer,https://www.seek.com.au/jobs/job/36511193?type=standard,Melbourne,Bayside & South Eastern Suburbs,4d ago,"Bring your web and graphic designing experience to a young, vibrant and fun environment located in South East Melbourne."
