Title,URL,Advertiser,Location,Listing Date,Short Description
Senior PHP/Wordpress Developer,https://www.seek.com.au/jobs/job/36520332?type=standard,Glide Agency,Perth,3d ago,Glide Agency is Perth's leading-edge Digital Agency and we need an experienced and technical Senior PHP/WordPress Developer to help grow our web team.
PHP Developer,https://www.seek.com.au/jobs/job/36519398?type=standout,Rowben Consulting - Integrity | Quality | Commitment,Perth,3d ago,"6 Month Contract. PHP / HTML5, CSS3, JQuery, JavaScript/AJAX. New Projects. Global Organisation. Daily Rate Contract. "
PHP Developer,https://www.seek.com.au/jobs/job/36509365?type=standout,Peoplebank Australia WA,Perth,4d ago,"Seeking a talented PHP Developer (full stack) for rapidly growing, ASX listed organization. Technically innovative, friendly and social team culture."
PHP Developers,https://www.seek.com.au/jobs/job/36253147?type=standout,ELMO Software Limited,Perth,9d ago,"Australia's fastest growing HR and Payroll company seeks experienced developers with skills in PHP, SQL and open source framework, to join our team."
PHP Developer,https://www.seek.com.au/jobs/job/36483566?type=standout,Rowben Consulting - Integrity | Quality | Commitment,Perth,8d ago,"6 Month Contract. PHP / HTML5, CSS3, JQuery, JavaScript/AJAX. New Projects. Global Organisation. Daily Rate Contract. "
PHP Developer,https://www.seek.com.au/jobs/job/36464966?type=standout,Rowben Consulting - Integrity | Quality | Commitment,Perth,10d ago,"6 Month Contract. PHP / HTML5, CSS3, JQuery, JavaScript/AJAX. New Projects. Global Organisation. Daily Rate Contract. "
Back End Software Developer (PHP/.Net),https://www.seek.com.au/jobs/job/36470659?type=standout,Hays Information Technology,Perth,9d ago,Help shape the future of our most valuable resource!
Penetration Tester x 2,https://www.seek.com.au/jobs/job/36537273?type=standout,Peoplebank Australia WA,Perth,1d ago,"Performing vulnerability assessments and penetration tests of various infrastructure and devices connected to external or internal networks
"
Web Developer,https://www.seek.com.au/jobs/job/36509372?type=standout,JAZ Creative,Perth,4d ago,Manage all things web ensuring JAZ is an innovator and leader In making the web an integral part of marketing and delivering real results
SEO Analyst,https://www.seek.com.au/jobs/job/36499811?type=standard,Ignite Search,Perth,5d ago,"Do you totally love SEO, Content Marketing but haven't quite found the agency that you fit in or feel understood? If so, welcome to your new home :)"
DevOps Engineer,https://www.seek.com.au/jobs/job/36498569?type=standard,ClickSend,Perth,5d ago,DevOps expert to join a rapidly growing small tech company.
Frontend Developer,https://www.seek.com.au/jobs/job/36463704?type=standout,Nicoh,Perth,10d ago,"A very exciting opportunity for a forward thinking and talented front end developer, to join a company that is focused on providing business solutions"
Web Developer | Juicebox,https://www.seek.com.au/jobs/job/36451698?type=standard,Juicebox,Perth,11d ago,We're looking for an experienced Developer capable of contributing to and assisting in executing the work we create for our clients.
Developers,https://www.seek.com.au/jobs/job/36448673?type=standout,Peoplebank Australia WA,Perth,11d ago,We are currently looking for experienced DEVELOPERS to service multiple contract and permanent opportunities across multiple client sites.
