Title,URL,Advertiser,Location,Listing Date,Short Description
EOI CS VE Teacher Diploma of Information Technology,https://www.seek.com.au/jobs/job/36510311?type=standard,RMIT University,Melbourne,4d ago,"We are currently inviting expressions of interest for sessional teachers in our Diploma of Information Technology program for Semester 2, 2018"
Lead Software Developer,https://www.seek.com.au/jobs/job/36509691?type=standard,ayuda hosting pty ltd,Melbourne,4d ago,Fantastic opportunity for a talented and passionate programmer to take lead role in the design and development of software in a Linux environment.
Senior Developer,https://www.seek.com.au/jobs/job/36509073?type=standard,Opus Recruitment Solutions,Melbourne,4d ago,JOIN A MARKET LEADING COMPANY | 6 MONTH CONTRACT WITH POTENTIAL EXTENSION | LUCRATIVE DAY RATE
Digital Marketing Manager,https://www.seek.com.au/jobs/job/36508748?type=standout,WBP Group,Melbourne,4d ago,WBP Group is seeking a creative Digital Marketing Manager to join the national marketing team. APPLICATIONS CLOSE 26th JUNE 2018
Frontend Developer,https://www.seek.com.au/jobs/job/36508477?type=standard,The Learning Hook,Melbourne,4d ago,Giant in HTML and WordPress - URGENT start - 02 July - Read more
Great opportunity to join an awesome technology startup!,https://www.seek.com.au/jobs/job/36502461?type=standard,Quitch,Melbourne,4d ago,"Seeking a passionate, innovative, experienced mobile/web developer to join our startup. Small team and Hawthorn based. Don't miss this opportunity!"
Senior Developer,https://www.seek.com.au/jobs/job/36501620?type=standard,eCreators,Melbourne,5d ago,Are you a Senior Developer who wants to work in a fast paced growing eLearning business? If you love a challenge and love to learn then apply today.
Junior / Early Career PHP Developer - Melbourne CBD,https://www.seek.com.au/jobs/job/36336340?type=standout,Catalyst IT Australia Pty Ltd,Melbourne,26d ago,Catalyst IT are looking for graduate and early career PHP developers to join the development team in our growing Melbourne CBD office.
Front End Developer / Web Developer,https://www.seek.com.au/jobs/job/36499320?type=standard,PBI Search,Melbourne,5d ago,"Work as a Front End Developer / Web Developer for this global media giant, be responsible for a range of projects using all the latest FE technologies"
Oracle Service Cloud Administrator,https://www.seek.com.au/jobs/job/36498743?type=standard,Greythorn,Melbourne,5d ago,Are you a strong Technical Administrator with Oracle Service Cloud? APPLY NOW!!
Senior Front End Developer,https://www.seek.com.au/jobs/job/36498256?type=standard,become,Melbourne,5d ago,Fancy getting out of the city into the leafy suburbs of South Melbourne? Are you a natural leading full of ideas and innovation?
AWS/DevOps Consultant,https://www.seek.com.au/jobs/job/36497595?type=standard,FRG Technology Consulting,Melbourne,5d ago,Have you got hands-on experience in driving forward Cloud solutions? Are you passionate about developing CI/CD pipelines?
Customer Support Specialist,https://www.seek.com.au/jobs/job/36491319?type=standout,Network Dynamics Pty Ltd,Melbourne,6d ago,We’re currently seeking an experienced full-time team member to provide technical and general sales support for web hosting clients.
Application Support Analyst,https://www.seek.com.au/jobs/job/36491076?type=standard,Uniting (Victoria and Tasmania) Limited,Melbourne,6d ago,Great opportunity to work closely with the CRM Product Owner and Delivery Team in owning and managing the build of a quality end-to-end product.
Contract Drupal Developer,https://www.seek.com.au/jobs/job/36465986?type=standout,Rowben Consulting - Integrity | Quality | Commitment,Melbourne,10d ago,Drupal Development | Daily Rate Contract | CBD Location
PHP Developer,https://www.seek.com.au/jobs/job/36339804?type=standout,Alaress.com.au,Melbourne,25d ago,You have solid experience in working in an Agile environment and can build scalable web apps from the ground up.
PHP Developer,https://www.seek.com.au/jobs/job/36331895?type=standard,Just Digital People,Melbourne,26d ago,PHP Developers needed ASAP!
PHP Developer,https://www.seek.com.au/jobs/job/36331897?type=standard,Just Digital People,Melbourne,26d ago,2 PHP Developers
PHP Developer,https://www.seek.com.au/jobs/job/36331898?type=standard,Just Digital People,Melbourne,26d ago,Are you an awesome PHP Developer? Want to work in a truly awesome business? Look no further...
Web Developer,https://www.seek.com.au/jobs/job/36486293?type=standard,Smaart Recruitment,Melbourne,8d ago,IT/Web Developer | Cheltenham location | Global company and leader in its industry | Full Time Monday to Friday position | Competitive Salary
Full-Stack PHP Developer,https://www.seek.com.au/jobs/job/36328857?type=standard,PBI Search,Melbourne,26d ago,"Work as Full-Stack PHP Developer, developing next-gen software for this recognised Software Solution Provider in the Melbourne CBD. Attractive salary!"
BackEnd PHP Developer | Symfony Framework | Build Large Scale Applications,https://www.seek.com.au/jobs/job/36325232?type=standard,Northbridge Recruitment,Melbourne,27d ago,Exciting PHP Development role to work with in a Mobile Application Development Agency that is working with some of the biggest names in tech!! CBD 9-5
Software Engineer/Developer,https://www.seek.com.au/jobs/job/36483760?type=standout,Outware Mobile (part of Arq Group),Melbourne,8d ago,Develop high quality code for some of Australia's biggest brands!
"Front End Developer - CONTRACT - React Native, server-less, AWS",https://www.seek.com.au/jobs/job/36481783?type=standard,Sirius Technology Melbourne part of Sirius People Pty Ltd,Melbourne,8d ago,"My client is a non-for-profit organisation based in the Northern suburbs of Melbourne looking for a strong Developer with React Native/React, AWS!"
eCommerce Website Development Manager,https://www.seek.com.au/jobs/job/36481688?type=standard,Megantic Pty. Ltd.,Melbourne,8d ago,"The right candidate will be able to interact well with stakeholders and developers to provide guidance, suggestions as well as coordinate the workflow"
CRM Administrator (Oracle Service Cloud),https://www.seek.com.au/jobs/job/36481168?type=standout,Talent – Winner ‘Seek Large Recruitment Agency of the Year’ 3 consecutive years!,Melbourne,8d ago,CRM Administrator/Application Support role within a well established organisation. Start ASAP. Oracle Service Cloud 
1*Backend Developer (Laravel/Django) and 1*Frontend Developer (React/Vue),https://www.seek.com.au/jobs/job/36480747?type=standard,61Financial,Melbourne,8d ago,"In charge of development of 61 Financial web project, Backend in Laravel/Django or Frontend in React.js/Vue.js"
Junior Web Developer,https://www.seek.com.au/jobs/job/36478888?type=standout,Voyance Insights,Melbourne,8d ago,"The Junior Website Developer will be responsible for the creation of user optimised, device responsive and engaging webpages and digital assets."
Lead Software Developer,https://www.seek.com.au/jobs/job/36478363?type=standard,FourQuarters Recruitment,Melbourne,8d ago,Excellent opportunity for a Lead Software Developer to join an incredible tech start-up - $120k-$150k + super
.NET Developer,https://www.seek.com.au/jobs/job/36477949?type=standout,Interactiveinc  PTY LTD,Melbourne,8d ago,"C# .NET / CMS Developer - Digital, Mobile, Interactive Agency"
Web Developer / Front End Developer - Exciting Agency Role,https://www.seek.com.au/jobs/job/36477332?type=standard,Green Hat,Melbourne,8d ago,We're looking for a talented Web/Front End Developer to join our digital team. This is a 12-month contract with the possibility of a permanent role.
Junior Developer,https://www.seek.com.au/jobs/job/36475583?type=standard,Shopfront,Melbourne,9d ago,Want to be a part of the future of retail in an energetic team? Shopfront is developing next generation point of sale applications and is hiring!
"Website Developer - PHP, MySQL, JS/Ajax Programming",https://www.seek.com.au/jobs/job/36324614?type=standout,Mittoni Pty Ltd,Melbourne,27d ago,"We are seeking programmers with excellent PHP, JS/AJAX, MySQL and general programming knowledge. Become part of an exciting, growing team!"
Website Developer,https://www.seek.com.au/jobs/job/36473924?type=standout,Digital Bridge,Melbourne,9d ago,We are looking for problem solver to help our team with our busy work load. We are looking for the right person for our next stage of growth.
Web Developer,https://www.seek.com.au/jobs/job/36472245?type=standard,Cloud Stratagem Pty. Ltd.,Melbourne,9d ago,A position has become available for a Web Developer as part of our Development team at our offices in St Kilda
EMS Software Engineer,https://www.seek.com.au/jobs/job/36470740?type=standard,LAF Technologies Pty Ltd,Melbourne,9d ago,LAF Technologies is seeking to employ the services of a full time EMS Software Engineer who will be ideally located in our Melbourne head office.
Mid-Level Drupal Developer (Brisbane Location),https://www.seek.com.au/jobs/job/36469051?type=standout,Paxus Australia Pty Ltd,Melbourne,9d ago,Looking for a smart and motivated Mid-level Drupal Developer to join an excellent and reputable organization in Brisbane’s CBD fringe.
Digital Project Manager,https://www.seek.com.au/jobs/job/36466589?type=standard,Opentop,Melbourne,10d ago,"Prepare, import and manage detailed project plans while co-ordinating the Development and Design teams through to product delivery."
Software Engineer,https://www.seek.com.au/jobs/job/36461858?type=standard,Xacom Pty Ltd,Melbourne,10d ago,"Australian Owned and Operated Company, Located in Melbourne’s South East, Relaxed Professional Environment, Dynamic Team, Competitive Remuneration.."
React Developer,https://www.seek.com.au/jobs/job/36461816?type=standard,Your Creative Pty Ltd,Melbourne,10d ago,Junior/mid-weight front-end/SPA role with opportunity to be part of a growing start-up.
"Developer - Angular, TypeScript",https://www.seek.com.au/jobs/job/36461505?type=standard,Two Bridges,Melbourne,10d ago,"Our small team is seeking an intermediate or senior software developer. The role is predominantly project work, with a focus on front-end development."
Part Time Mid to Senior Front-End Web Developer/Designer with Creative Flair,https://www.seek.com.au/jobs/job/36460878?type=standard,Jalapeno Creative,Melbourne,10d ago,South Melbourne design studio seeking a part time conceptually minded Mid to Senior Front-End Developer/Designer to join our flexible and fun team.
Web Developer,https://www.seek.com.au/jobs/job/36460829?type=standard,become,Melbourne,10d ago,"An Integrated agency in South Melbourne is looking to grow their digital offering and is looking for a motivated, passionate and driven Web Developer"
Splunk Analysts and Specialists,https://www.seek.com.au/jobs/job/36458218?type=standout,Accenture,Melbourne,10d ago,Help the world’s biggest brands take advantage of cutting-edge technologies.
Helpdesk Application Support,https://www.seek.com.au/jobs/job/35938429?type=standard,Helloworld Travel Limited,Melbourne,10d ago,"Located in our South Melbourne office, a vacancy exists for a Helpdesk Application Support role."
Magento Developer - Permanent,https://www.seek.com.au/jobs/job/36457189?type=standout,Talent – Winner ‘Seek Large Recruitment Agency of the Year’ 3 consecutive years!,Melbourne,10d ago,"This position is a rarely-seen opening within this global giant.  You will be amongst some of the finest with the Australian marketplace, and"
WordPress Developer,https://www.seek.com.au/jobs/job/36455467?type=standard,Greythorn,Melbourne,11d ago,Word Press Developer - Front End developer located in the Heart of Melbourne
Senior Developer,https://www.seek.com.au/jobs/job/36452467?type=standard,Opus Recruitment Solutions,Melbourne,11d ago,JOIN A MARKET LEADING COMPANY | 6 MONTH CONTRACT WITH POTENTIAL EXTENSION | LUCRATIVE DAY RATE
Drupal Developer,https://www.seek.com.au/jobs/job/36452320?type=standard,Opus Recruitment Solutions,Melbourne,11d ago,JOIN A MARKET LEADING COMPANY | 6 MONTH CONTRACT WITH POTENTIAL EXTENSION | LUCRATIVE DAY RATE
Digital Marketing Executive,https://www.seek.com.au/jobs/job/36448773?type=standout,Melbourne,Eastern Suburbs,11d ago,We're looking for a Marketing Executive with a strong background in digital technologies to drive our digital strategies.
Front End Developer / Web Developer,https://www.seek.com.au/jobs/job/36448460?type=standard,PBI Search,Melbourne,11d ago,"Work as a Front End Developer / Web Developer for this global media giant, be responsible for a range of projects using all the latest FE technologies"
Big Data Engineer,https://www.seek.com.au/jobs/job/36446806?type=standout,SALT SEARCH PTY LTD,Melbourne,11d ago,An exciting opportunity to join a world leader in digital technology consulting as a Big Data Engineer and work within a variety of industries.
Team Lead,https://www.seek.com.au/jobs/job/36445852?type=standard,Opus Recruitment Solutions,Melbourne,12d ago,"DIGITAL AGENCY | FAST GROWING COMPANY|GREAT TEAM ENVIRONMENT | $90,000 - $120,000 + SUPER | MELBOURNE"
Junior iOS Developer (Swift / ObjC),https://www.seek.com.au/jobs/job/36445395?type=standout,Michael Page Technology,Melbourne,12d ago,Native iOS Developer with extensive Swift and/or ObjC experience
Magento Developer,https://www.seek.com.au/jobs/job/36209533?type=standout,Balance Internet,Melbourne,13d ago,"A Magento Developer role at a Leading Magento eCommerce consultancy in APAC, working with the top retailers, B2C and B2B enterprises."
Front end developer for film technology web startup,https://www.seek.com.au/jobs/job/36438110?type=standout,SAVAGE Film Services,Melbourne,13d ago,"We’re looking for a disciplined, self-motivated, detail-oriented front end developer who’s ready to get stuck into developing."
Software Developers 2 Mid or Senior $80 - $140k +,https://www.seek.com.au/jobs/job/36403379?type=standard,Interface Recruitment,Melbourne,18d ago,2 roles. 2 Senior 2 Digital Agency PHP WordPress JavaScript Developers. Quality clients. All career roles. Public transport -tick! Dog bowls - tick!
Mid-Level PHP Developer,https://www.seek.com.au/jobs/job/36322330?type=standout,Fulfilio,Melbourne,29d ago,"We are looking for a very TALENTED, PASSIONATE, FULL HANDS-ON and professional mid-senior PHP developer with solid commercial experience."
IntelligenceBank - Full Stack Developer,https://www.seek.com.au/jobs/job/36397052?type=standard,IntelligenceBank Pty Ltd,Melbourne,18d ago,"IntelligenceBank, a leading SaaS platform with offices in Melbourne and San Diego is looking for a full stack developer with experience in PHP and JS."
PHP Developer,https://www.seek.com.au/jobs/job/36320273?type=standout,Aurec,Melbourne,29d ago,PHP Developer required for contract opportunity in Melbourne CBD - 6 month rolling contract
PHP Developer,https://www.seek.com.au/jobs/job/36316801?type=standout,Trellian,Melbourne,29d ago,Exciting full-time role for an experienced PHP programmer working on a domain auction platform and other high end domain name solutions.
"Front End Developer - CONTRACT - React Native, server-less, AWS",https://www.seek.com.au/jobs/job/36434552?type=standard,Sirius Technology Melbourne part of Sirius People Pty Ltd,Melbourne,15d ago,"My client is a non-for-profit organisation based in Northern suburbs of Melbourne looking for a Developer with React Native, AWS, Preston Location!"
Critical Opening for API Testing and Automation,https://www.seek.com.au/jobs/job/36378616?type=standard,Ampstek Australia Pty Ltd,Melbourne,22d ago,"API platform Testing, JMeter, Master-Slave configuration, develop &amp; test API automation framework, PHP, Ruby, Watir, Selenium, Cucumber, POSTMAN"
Teachers (Sessional) - Full Stack Web Designer/Developer,https://www.seek.com.au/jobs/job/36427451?type=standard,Holmesglen Institute,Melbourne,15d ago,Are you looking to take a break from industry? Teaching is a great way to put back into the web community &amp; guide the next generation of web designers
Customer Success Manager - eCommerce Agency,https://www.seek.com.au/jobs/job/36427338?type=standout,Balance Internet,Melbourne,15d ago,"A Customer Success Manager role at a Leading Magento eCommerce consultancy in APAC, working the largest retailers, B2C and B2B enterprises."
Contract Drupal Developer,https://www.seek.com.au/jobs/job/36412449?type=standout,Rowben Consulting - Integrity | Quality | Commitment,Melbourne,17d ago,Drupal Development | Daily Rate Contract | CBD Location
Front End Developer / Web Developer,https://www.seek.com.au/jobs/job/36423257?type=standard,PBI Search,Melbourne,16d ago,"Work as a Front End Developer / Web Developer for this global media giant, be responsible for a range of projects using all the latest FE technologies"
Salesforce developer,https://www.seek.com.au/jobs/job/36423060?type=standard,Delivery Centric Tech Services Pty Ltd,Melbourne,16d ago,Salesforce Developer in Melbourne &amp; Sydney
Front End Developer (VueJS) - Creative Agency,https://www.seek.com.au/jobs/job/36422946?type=standout,FourQuarters Recruitment,Melbourne,16d ago,Are you excited about the VueJS library? Would you like to use this technology in your next job to build web solutions?
"Warlord Of SEO (Organic Search, SEO Specialist, Digital Strategist)",https://www.seek.com.au/jobs/job/36420855?type=standout,King Kong,Melbourne,16d ago,***RARE OPPORTUNITY TO JOIN AUSTRALIA'S FASTEST GROWING FULL-SERVICE DIGITAL AGENCY***
Drupal Developer,https://www.seek.com.au/jobs/job/36419102?type=standout,FourQuarters Recruitment,Melbourne,16d ago,A unique opportunity for a Drupal Developer to join an award winning digital agency
Java Developer | MELBOURNE | International award-winning consultancy,https://www.seek.com.au/jobs/job/36178745?type=standard,Adelphi Digital,Melbourne,16d ago,We are looking for graduate and experienced Java developers to join our international digital consultancy located in the heart of the CBD
Graduate Web Developer | MELBOURNE | International award-winning consultancy,https://www.seek.com.au/jobs/job/36183768?type=standard,Adelphi Digital,Melbourne,16d ago,We are looking for graduate developers to join our international digital consultancy located in the heart of the CBD
DevOps Engineer,https://www.seek.com.au/jobs/job/36414299?type=standard,MessageMedia,Melbourne,17d ago,We've building products that give people back time to do the things they love. Come and help us solve the interesting challenges that come with that.
"Front End Developer - CONTRACT - React Native, server-less, AWS",https://www.seek.com.au/jobs/job/36413891?type=standard,Sirius Technology Melbourne part of Sirius People Pty Ltd,Melbourne,17d ago,My client is a non-for-profit organisation based in Northern suburbs of Melbourne looking for a Front End Dev with AWS and exp! Preston Location!
Full-Stack Developer (PHP),https://www.seek.com.au/jobs/job/36304044?type=standard,Lucidity Software,Melbourne,30d+ ago,"Seeking a talented, experienced PHP developer to join our team in Port Melbourne, with experience in full stack development."
PHP Developer - Contract,https://www.seek.com.au/jobs/job/36306981?type=standout,Digital2Go,Melbourne,30d ago,"We are looking for a Skilled PHP developer to join us for a 6 month contract (with the potential to extend). CakePHP, MVC, AWS, GIS, iBeacons"
Web Developer,https://www.seek.com.au/jobs/job/36411789?type=standout,Hays Information Technology,Melbourne,17d ago,Exciting Fixed Term Contract Opportunity in Education Sector until 2020 in North Melbourne.
Senior Support Engineer (Developer/Coder),https://www.seek.com.au/jobs/job/36411431?type=standout,SALT SEARCH PTY LTD,Melbourne,17d ago,"Senior Support Engineer
Global Software House
Melbourne - Permanent "
Assistant Web Developer,https://www.seek.com.au/jobs/job/36410745?type=standard,GMT People,Melbourne,17d ago,Support the Web Developer with the implementation of new web services. Craft functional/creative user experiences. Drupal / HTML / CSS. 3m initially.
Senior Web Developer,https://www.seek.com.au/jobs/job/36408292?type=standard,Melbourne,CBD & Inner Suburbs,17d ago,"Yoke, a full-service creative agency in Collingwood, is actively seeking a Senior WordPress Developer"
Drupal Developer,https://www.seek.com.au/jobs/job/36390218?type=standout,Rowben Consulting - Integrity | Quality | Commitment,Melbourne,19d ago,Drupal Development | Daily Rate Contract | CBD Location
PHP Developer,https://www.seek.com.au/jobs/job/36308440?type=standard,Robert Half Technology,Melbourne,30d ago,Apply your software engineering skills to a diverse and engaging workplace focused in delivering a range of web products and solutions. 
Junior/Graduate/Mid Developer (PHP + Various Technologies) Permanent,https://www.seek.com.au/jobs/job/36302960?type=standard,3 Dimensional Consulting Pty Ltd,Melbourne,30d+ ago,"Do you like variation, want to set a solid career foundation, can you think broadly outside the square?"
Mid-level Full Stack Web Developer,https://www.seek.com.au/jobs/job/36401395?type=standout,99designs,Melbourne,18d ago,We're after a passionate full stack web developer to join our Melbourne office building the world's best graphic design marketplace
Senior Linux Professional,https://www.seek.com.au/jobs/job/36401173?type=standard,Innovate IT Consultancy Pty Ltd,Melbourne,18d ago,"Linux Administration , Internet protocols, AWS"
Business & Systems Analyst for Custom App,https://www.seek.com.au/jobs/job/36196904?type=standard,Data Difference Pty Ltd,Melbourne,18d ago,Senior Business Analyst for immediate start with attractive daily rate.
E-Commerce Specialist,https://www.seek.com.au/jobs/job/36247572?type=standard,Richmond Wheel & Castor Co.,Melbourne,18d ago,"In this role, you will be responsible for driving the growth of our 3 websites, supporting over 3000 products, and identifying new opportunities."
SEO Specialist,https://www.seek.com.au/jobs/job/36390150?type=standout,Dentsu Aegis Network,Melbourne,19d ago,This specialist role within the SEO team will be directly working on some of Australia's biggest brands.
Level 2 Technical Support Analyst,https://www.seek.com.au/jobs/job/36387527?type=standard,Greythorn,Melbourne,19d ago,Technical Support Analyst required please enquire for more information!
Full Stack Developer,https://www.seek.com.au/jobs/job/36387523?type=standout,Exelect Recruitment,Melbourne,19d ago,Wonderful opportunity for a motivated Full Stack Developer to join an innovative development company that creates a range of software products
Software Development Manager,https://www.seek.com.au/jobs/job/36385984?type=standout,FourQuarters Recruitment,Melbourne,19d ago,"Growing software house are looking for a Development Manager for their growing, high performing development team"
Front End Developer / Web Developer,https://www.seek.com.au/jobs/job/36385811?type=standard,PBI Search,Melbourne,19d ago,"Work as a Front End Developer / Web Developer for this global media giant, be responsible for a range of projects using all the latest FE technologies"
Web Developer - Front End - Graphic Designer,https://www.seek.com.au/jobs/job/36381287?type=standout,Feck Pty. Ltd.,Melbourne,20d ago,"We're looking for a highly experienced, creative web designer/developer to join our small team, as lead web developer."
IT Support - Managed Service Provider,https://www.seek.com.au/jobs/job/36376582?type=standard,Melbourne,CBD & Inner Suburbs,22d ago,Calling all experienced Microsoft Techs with excellent customer service!! Growing Managed Service Provider based in the Melbourne CBD
Full Stack Developer,https://www.seek.com.au/jobs/job/36376045?type=standout,NOW Digital,Melbourne,22d ago,NOW Digital are looking for an enthusiastic individual to join their diverse team of developers to build quality solutions while having fun doing it.
Digital marketing Specialist/Lead | SEO | Awesome agency,https://www.seek.com.au/jobs/job/36373574?type=standard,Yolk Agency,Melbourne,22d ago,Want to work for a company that has great culture and supportive management? Do you have onsite and offsite optimisation experience? Richmond location
Automation Tester,https://www.seek.com.au/jobs/job/36372289?type=standout,Michael Page Technology,Melbourne,22d ago,Initial six month contract role for an Automation Tester
Wordpress Developer,https://www.seek.com.au/jobs/job/36370770?type=standout,Milestone Information Technology,Melbourne,22d ago,Milestone IT are working with this fantastic business to identify and provide an experienced Wordpress Developer on contract for initially 3 months...
Front End Developer / Web Developer,https://www.seek.com.au/jobs/job/36369910?type=standard,PBI Search,Melbourne,23d ago,"Work as a Front End Developer / Web Developer for this global media giant, be responsible for a range of projects using all the latest FE technologies"
Senior JavaScript Developer - Node.js Focus - $150k + Super,https://www.seek.com.au/jobs/job/36367685?type=standard,Big Wave Digital,Melbourne,23d ago,A talented JavaScript Engineer with Node.js expertise required for BIG greenfield platform build in Dynamic Fintech business.
Full Stack Digital Developer Senior,https://www.seek.com.au/jobs/job/36356999?type=standard,Interface Recruitment,Melbourne,24d ago,Digital Agency. Great growing client list. Senior Developer with ability to take on Technical Lead now or in the future.
Full Stack Web Developer,https://www.seek.com.au/jobs/job/36354832?type=standard,MovingMate,Melbourne,24d ago,This is a unique opportunity to have an active presence in a large and diverse global technology platform.
Mid-level Magento Developer | Senior Magento Developer | Lead,https://www.seek.com.au/jobs/job/36354662?type=standard,Sirius Technology Melbourne part of Sirius People Pty Ltd,Melbourne,24d ago,"Multiple roles for:
- Mid-level Magento Developer(s)
- Senior Magento Developer(s)
- Lead Magento Developer

Work for a market leader!"
