Title,URL,Advertiser,Location,Listing Date,Short Description
Front End Wordpress Developer(s) with vibe! (PT/Casual),https://www.seek.com.au/jobs/job/36353422?type=standout,WhiteRhino Creative PL,Melbourne,24d ago,WhiteRhino is looking for some switched-on part time /casual wordpress web developers to assist our digital development work
Front End Developer,https://www.seek.com.au/jobs/job/36351250?type=standard,become,Melbourne,24d ago,Front End Developer wanted to be solely responsible for creative Front End Development of Websites &amp; Applications at a up &amp; coming Melbourne Agency.
WordPress Developer,https://www.seek.com.au/jobs/job/36351227?type=standard,GMT People,Melbourne,24d ago,Experienced WordPress Developer to takeover current work &amp; lead website completion within an agreed timeframe. Cloud environment - asap start.
Junior Or Mid Full Stack Developer,https://www.seek.com.au/jobs/job/36344494?type=standard,WILLIAMSMEDIA,Melbourne,25d ago,"Junior-Mid Full Stack/Frontend/Backend Dev. Ability to self manage, take ownership and like solving challenging problems. https://williamsmedia.com.au"
Front End Developer,https://www.seek.com.au/jobs/job/36342655?type=standard,Openpay Pty Ltd,Melbourne,25d ago,"Are you a Wordpress capable developer? Do you understand how plug-ins work and could write your own theme? Excellent, you're invited to apply!!!!"
FULL STACK DEVELOPER - PHP / Angular / React,https://www.seek.com.au/jobs/job/36072356?type=standard,myEd,Melbourne,30d+ ago,Are you a talented full stack developer looking to join a team passionate about social impact and excited by tough technical challenges?
Oracle Policy Automation Developer,https://www.seek.com.au/jobs/job/36144159?type=standout,Dialog IT,Melbourne,25d ago,"Dialog seek an Oracle Policy Automation Developer, responsible for capturing, managing, &amp; deploying complex legislation and document-based policies."
"Front End Developer - Perm - React Native, server-less, AWS",https://www.seek.com.au/jobs/job/36340917?type=standard,Sirius Technology Melbourne part of Sirius People Pty Ltd,Melbourne,25d ago,My client is a non-for-profit organisation based in Northern suburbs of Melbourne looking for a Front End Dev with AWS and exp! Preston Location!
Front End Developer (Mid-Senior),https://www.seek.com.au/jobs/job/36337467?type=standout,Northmost,Melbourne,26d ago,Northmost are looking for a passionate mid to senior Front End Developer with proven experience in bringing user experiences to life.
IT Support Officer - Junior Programmer,https://www.seek.com.au/jobs/job/36337028?type=standout,Orima Research,Melbourne,26d ago,We are seeking a highly capable person with problem solving skills to assist our growing IT Applications team.
Full Stack Developer,https://www.seek.com.au/jobs/job/36334865?type=standout,Hays Information Technology,Melbourne,26d ago,"A rare permanent opportunity - play an integral role in the IT direction of a cutting-edge company, working on greenfield projects with an expert team"
Front End Developer,https://www.seek.com.au/jobs/job/36334842?type=standard,Randstad - Technologies,Melbourne,26d ago,A rapidly growing Digital Agency based in the CBD is looking for a Mid level Front End Developer who wants to expand there experience.
Front End Developer - Perm - JavaScript - Melbourne,https://www.seek.com.au/jobs/job/36334105?type=standard,Sirius Technology Melbourne part of Sirius People Pty Ltd,Melbourne,26d ago,My client is a non-for-profit organisation based in Northern suburbs of Melbourne looking for a Front End Dev with AWS and exp! Preston Location!
SEO Strategist,https://www.seek.com.au/jobs/job/36332105?type=standard,Digital360,Melbourne,26d ago,We're seeking a technical SEO expert to help us develop our search marketing strategies.
Scientific Software Developer,https://www.seek.com.au/jobs/job/36331711?type=standard,CSL Limited,Melbourne,26d ago,"Unique opportunity to lead, promote, and shape scientific software development at CSL"
Frontend Developer / Web Developer,https://www.seek.com.au/jobs/job/36328860?type=standard,PBI Search,Melbourne,26d ago,"Work as a Frontend Developer / Web Developer for this global media giant, be responsible for a range of projects using all the latest FE technologies."
Software Development Engineer,https://www.seek.com.au/jobs/job/36328294?type=standout,Melbourne,Eastern Suburbs,26d ago,We are seeking a passionate and experienced developer that is interested in a variety of technological solutions.
Web Developer,https://www.seek.com.au/jobs/job/36328050?type=standout,Furphy Media Group,Melbourne,26d ago,Furphy Media is seeking a industry-experienced Web Developer to join our team.
DevOps Engineer | Mobile Consultancy | AWS | CI/CD Pipelines | CBD,https://www.seek.com.au/jobs/job/36325233?type=standard,Northbridge Recruitment,Melbourne,27d ago,"Do you wish that the company you work for was constantly engaged in exciting Bleeding Edge Technology based projects? If SO, this is the role for you!"
Front End Developer - Perm - JavaScript & AWS - Melbourne,https://www.seek.com.au/jobs/job/36320647?type=standard,Sirius Technology Melbourne part of Sirius People Pty Ltd,Melbourne,29d ago,My client is a non-for-profit organisation based in Northern suburbs of Melbourne looking for a Front End Dev with AWS and exp! Preston Location!
Web Developer x2,https://www.seek.com.au/jobs/job/36315372?type=standard,Helloworld Travel Limited,Melbourne,29d ago,"As Java Developer (B2B) you will build solutions that are highly sustainable and flexible, architecturally sound and perform optimally."
"Digital Project Manager, Magento / eCommerce",https://www.seek.com.au/jobs/job/36313767?type=standard,Balance Internet,Melbourne,30d ago,"A Project Management role at a Leading Magento eCommerce consultancy in APAC, working the largest retailers, B2C and B2B enterprises."
(Lead) Big Data Developer,https://www.seek.com.au/jobs/job/36310247?type=standard,Cognizant Technology Solutions Australia Pty Ltd,Melbourne,30d ago,Cognizant has won a large piece of work to support one of our tech clients with their cloud products and services. Multiple roles available.
(Lead) Cloud Network Engineer,https://www.seek.com.au/jobs/job/36309841?type=standard,Cognizant Technology Solutions Australia Pty Ltd,Melbourne,30d ago,Cognizant has won a large piece of work to support one of our tech clients with their cloud products and services. Multiple roles available.
(Lead) Network Specialist | DevOps Engineer,https://www.seek.com.au/jobs/job/36309423?type=standard,Cognizant Technology Solutions Australia Pty Ltd,Melbourne,30d ago,Cognizant has won a large piece of work to support one of our tech clients with their cloud products and services. Various roles available.
(Lead) Network Specialist - System Administrator,https://www.seek.com.au/jobs/job/36308677?type=standard,Cognizant Technology Solutions Australia Pty Ltd,Melbourne,30d ago,Cognizant has won a large piece of work to support one of our tech clients with their cloud products and services. Multiple roles available.
"Software Engineer (AWS, Python, JS)",https://www.seek.com.au/jobs/job/36306865?type=standard,Agersens,Melbourne,30d ago,"We are looking for a passionate backend software engineer to join our unique, dynamic and inclusive AgTech IoT startup."
Freelance Full Stack Developer,https://www.seek.com.au/jobs/job/36239063?type=standard,Aquent,Melbourne,30d+ ago,A fantastic and innovative Softare Development Company are looking for a Full Stack Web Developer to join their team for 3 months.
Senior Full Stack Developer with Frontend Focus,https://www.seek.com.au/jobs/job/36320209?type=standout,Coredna,Melbourne,29d ago,Coredna makes the digitally complex simple on a global scale. We value strong engineers who are agile enough to jump into most projects.
AWS Cloud DevOps/Deployment Egineer,https://www.seek.com.au/jobs/job/36063168?type=standout,Amazon Web Services,Melbourne,30d+ ago,Seeking highly motivated DevOps engineers who are passionate about technology &amp; want to work with one of the fastest growing Cloud platforms
