Title,URL,Advertiser,Location,Listing Date,Short Description
Senior PHP/Wordpress Developer,https://www.seek.com.au/jobs/job/36520332?type=standard,Glide Agency,Perth,3d ago,Glide Agency is Perth's leading-edge Digital Agency and we need an experienced and technical Senior PHP/WordPress Developer to help grow our web team.
PHP Developer,https://www.seek.com.au/jobs/job/36519398?type=standout,Rowben Consulting - Integrity | Quality | Commitment,Perth,3d ago,"6 Month Contract. PHP / HTML5, CSS3, JQuery, JavaScript/AJAX. New Projects. Global Organisation. Daily Rate Contract. "
PHP Developer,https://www.seek.com.au/jobs/job/36509365?type=standout,Peoplebank Australia WA,Perth,4d ago,"Seeking a talented PHP Developer (full stack) for rapidly growing, ASX listed organization. Technically innovative, friendly and social team culture."
PHP Developers,https://www.seek.com.au/jobs/job/36253147?type=standout,ELMO Software Limited,Perth,9d ago,"Australia's fastest growing HR and Payroll company seeks experienced developers with skills in PHP, SQL and open source framework, to join our team."
PHP Developer,https://www.seek.com.au/jobs/job/36483566?type=standout,Rowben Consulting - Integrity | Quality | Commitment,Perth,8d ago,"6 Month Contract. PHP / HTML5, CSS3, JQuery, JavaScript/AJAX. New Projects. Global Organisation. Daily Rate Contract. "
PHP Developer,https://www.seek.com.au/jobs/job/36464966?type=standout,Rowben Consulting - Integrity | Quality | Commitment,Perth,10d ago,"6 Month Contract. PHP / HTML5, CSS3, JQuery, JavaScript/AJAX. New Projects. Global Organisation. Daily Rate Contract. "
Back End Software Developer (PHP/.Net),https://www.seek.com.au/jobs/job/36470659?type=standout,Hays Information Technology,Perth,9d ago,Help shape the future of our most valuable resource!
WordPress PHP Developer/Programmer,https://www.seek.com.au/jobs/job/36403919?type=standout,Dux Digital,Perth,18d ago,This is a fantastic opportunity for someone who wants to create industry-leading websites and applications.
Penetration Tester x 2,https://www.seek.com.au/jobs/job/36537273?type=standout,Peoplebank Australia WA,Perth,1d ago,"Performing vulnerability assessments and penetration tests of various infrastructure and devices connected to external or internal networks
"
Web Developer,https://www.seek.com.au/jobs/job/36509372?type=standout,JAZ Creative,Perth,4d ago,Manage all things web ensuring JAZ is an innovator and leader In making the web an integral part of marketing and delivering real results
SEO Analyst,https://www.seek.com.au/jobs/job/36499811?type=standard,Ignite Search,Perth,5d ago,"Do you totally love SEO, Content Marketing but haven't quite found the agency that you fit in or feel understood? If so, welcome to your new home :)"
DevOps Engineer,https://www.seek.com.au/jobs/job/36498569?type=standard,ClickSend,Perth,5d ago,DevOps expert to join a rapidly growing small tech company.
Frontend Developer,https://www.seek.com.au/jobs/job/36463704?type=standout,Nicoh,Perth,10d ago,"A very exciting opportunity for a forward thinking and talented front end developer, to join a company that is focused on providing business solutions"
Web Developer | Juicebox,https://www.seek.com.au/jobs/job/36451698?type=standard,Juicebox,Perth,11d ago,We're looking for an experienced Developer capable of contributing to and assisting in executing the work we create for our clients.
Developers,https://www.seek.com.au/jobs/job/36448673?type=standout,Peoplebank Australia WA,Perth,11d ago,We are currently looking for experienced DEVELOPERS to service multiple contract and permanent opportunities across multiple client sites.
Web Developer,https://www.seek.com.au/jobs/job/36428922?type=standout,Moodle,Perth,15d ago,"Imagine working on projects with international impact, that connects a community of millions... join Moodle and it’s an exciting reality!"
Digital Marketing Specialist,https://www.seek.com.au/jobs/job/36410957?type=standout,Bright People Technologies Pty Ltd,Perth,17d ago,Excellent role for someone who wants to jump on board and contribute to a rapidly growing company. Tremendously exciting opportunity!
Graduate Developer (Consultant Role),https://www.seek.com.au/jobs/job/36327767?type=standard,The Ruby Group,Perth,27d ago,"High Performing Graduates Development Role. May Start. Web Technologies. Oracle, Java, PHP, JavaScript, HTML..."
Ecommerce and Depository Developer,https://www.seek.com.au/jobs/job/36378316?type=standard,Gold Corporation,Perth,22d ago,"*Great Opportunity
*Competitive salary from $120K
*12 month contract
*Position based at Perth Mint 
"
Level 2 Support - Incident Management,https://www.seek.com.au/jobs/job/36376713?type=standout,Michael Page Technology,Perth,22d ago,"If you meet the technical requirements for this opportunity, please apply as this is a brilliant full time career opportunity. "
Graphic Designer (Job Share),https://www.seek.com.au/jobs/job/36363943?type=standard,UWA Student Guild,Perth,23d ago,The Guild is seeking an experienced and motivated Graphic Designer to job share with the current Designer to assist with graphic design services
Front End Web Developer,https://www.seek.com.au/jobs/job/36345764?type=standard,Web Wizards,Perth,25d ago,We are seeking a team player who loves web development to join our established and growing Perth web marketing company as a Front End Web Developer.
Oracle Policy Automation Developer,https://www.seek.com.au/jobs/job/36144260?type=standout,Dialog IT,Perth,25d ago,"Dialog seek an Oracle Policy Automation Developer, responsible for capturing, managing, &amp; deploying complex legislation and document-based policies."
